{
    "schema_version": "2.0",
    "plugin": {
        "slug": "social-icons",
        "name": "Social Icons",
        "version": "1.7.4",
        "source": "local",
        "scanned_at": "2026-08-16T18:00:02Z",
        "analyzer_version": "0.9.0"
    },
    "grade": "D",
    "score": 0,
    "coverage": {
        "files_scanned": 22,
        "files_skipped": 0,
        "write_calls_found": 10,
        "verified": 10,
        "resolved": 0,
        "pattern": 0,
        "dynamic": 0,
        "resolution_rate": 1.0
    },
    "cleanup": {
        "has_uninstall_php": true,
        "has_uninstall_hook": false,
        "conditional": false,
        "condition_option": null,
        "condition_default": null
    },
    "creates": {
        "options": [
            {
                "key": "social_icons_admin_footer_text_rated",
                "autoload": "unknown",
                "confidence": "verified",
                "cleaned": false,
                "sources": [
                    {
                        "file": "includes/class-si-ajax.php",
                        "line": 56
                    }
                ]
            },
            {
                "key": "social_icons_meta_box_errors",
                "autoload": "unknown",
                "confidence": "verified",
                "cleaned": false,
                "sources": [
                    {
                        "file": "includes/admin/class-si-admin-meta-boxes.php",
                        "line": 65
                    }
                ]
            }
        ],
        "tables": [],
        "cron": [],
        "transients": [],
        "post_meta": [
            {
                "key": "_add_nofollow",
                "confidence": "verified",
                "cleaned": false,
                "sources": [
                    {
                        "file": "includes/admin/meta-boxes/class-si-meta-box-group-data.php",
                        "line": 239
                    }
                ]
            },
            {
                "key": "_greyscale_icons",
                "confidence": "verified",
                "cleaned": false,
                "sources": [
                    {
                        "file": "includes/admin/meta-boxes/class-si-meta-box-group-data.php",
                        "line": 237
                    }
                ]
            },
            {
                "key": "_manage_label",
                "confidence": "verified",
                "cleaned": false,
                "sources": [
                    {
                        "file": "includes/admin/meta-boxes/class-si-meta-box-group-data.php",
                        "line": 236
                    }
                ]
            },
            {
                "key": "_open_new_tab",
                "confidence": "verified",
                "cleaned": false,
                "sources": [
                    {
                        "file": "includes/admin/meta-boxes/class-si-meta-box-group-data.php",
                        "line": 238
                    }
                ]
            },
            {
                "key": "_sortable_icons",
                "confidence": "verified",
                "cleaned": false,
                "sources": [
                    {
                        "file": "includes/admin/meta-boxes/class-si-meta-box-group-data.php",
                        "line": 240
                    }
                ]
            },
            {
                "key": "background_style",
                "confidence": "verified",
                "cleaned": false,
                "sources": [
                    {
                        "file": "includes/admin/meta-boxes/class-si-meta-box-group-data.php",
                        "line": 234
                    }
                ]
            },
            {
                "key": "icon_font_size",
                "confidence": "verified",
                "cleaned": false,
                "sources": [
                    {
                        "file": "includes/admin/meta-boxes/class-si-meta-box-group-data.php",
                        "line": 235
                    }
                ]
            }
        ],
        "user_meta": [],
        "term_meta": [],
        "comment_meta": [],
        "roles": [],
        "capabilities": [],
        "post_types": [
            {
                "key": "social_icon",
                "confidence": "verified",
                "cleaned": false,
                "sources": [
                    {
                        "file": "includes/class-si-post-types.php",
                        "line": 47
                    }
                ]
            }
        ],
        "taxonomies": [],
        "directories": [],
        "rewrite_rules": [],
        "actions": []
    },
    "modifies_core": [],
    "unresolved": []
}