{
    "schema_version": "2.0",
    "plugin": {
        "slug": "advanced-woo-labels",
        "name": "Advanced Woo Labels",
        "version": "2.50",
        "source": "local",
        "scanned_at": "2026-08-16T17:54:00Z",
        "analyzer_version": "0.9.0"
    },
    "grade": "D",
    "score": 38,
    "coverage": {
        "files_scanned": 64,
        "files_skipped": 0,
        "write_calls_found": 16,
        "verified": 16,
        "resolved": 0,
        "pattern": 0,
        "dynamic": 0,
        "resolution_rate": 1.0
    },
    "cleanup": {
        "has_uninstall_php": true,
        "has_uninstall_hook": false,
        "conditional": false,
        "condition_option": null,
        "condition_default": null
    },
    "creates": {
        "options": [
            {
                "key": "awl_hide_int_notices",
                "autoload": "no",
                "confidence": "verified",
                "cleaned": false,
                "sources": [
                    {
                        "file": "includes/admin/class-awl-admin-notices.php",
                        "line": 142
                    }
                ]
            },
            {
                "key": "awl_plugin_ver",
                "autoload": "unknown",
                "confidence": "verified",
                "cleaned": true,
                "sources": [
                    {
                        "file": "includes/class-awl-versions.php",
                        "line": 100
                    }
                ]
            },
            {
                "key": "awl_settings",
                "autoload": "unknown",
                "confidence": "verified",
                "cleaned": true,
                "sources": [
                    {
                        "file": "includes/admin/class-awl-admin-options.php",
                        "line": 120
                    },
                    {
                        "file": "includes/admin/class-awl-admin.php",
                        "line": 42
                    },
                    {
                        "file": "includes/class-awl-versions.php",
                        "line": 56
                    },
                    {
                        "file": "includes/class-awl-versions.php",
                        "line": 76
                    },
                    {
                        "file": "includes/class-awl-versions.php",
                        "line": 86
                    }
                ]
            }
        ],
        "tables": [],
        "cron": [],
        "transients": [
            {
                "key": "aws_labels_date_notices",
                "confidence": "verified",
                "cleaned": false,
                "sources": [
                    {
                        "file": "includes/admin/class-awl-admin-notices.php",
                        "line": 178
                    }
                ]
            }
        ],
        "post_meta": [
            {
                "key": "_awl_label",
                "confidence": "verified",
                "cleaned": false,
                "sources": [
                    {
                        "file": "advanced-woo-labels.php",
                        "line": 231
                    },
                    {
                        "file": "includes/class-awl-versions.php",
                        "line": 224
                    }
                ]
            },
            {
                "key": "_awl_label_priority",
                "confidence": "verified",
                "cleaned": false,
                "sources": [
                    {
                        "file": "includes/admin/class-awl-admin-duplicate-labels.php",
                        "line": 103
                    },
                    {
                        "file": "includes/admin/class-awl-admin.php",
                        "line": 139
                    },
                    {
                        "file": "includes/class-awl-taxonomy.php",
                        "line": 261
                    }
                ]
            },
            {
                "key": "_awl_save_amount_value",
                "confidence": "verified",
                "cleaned": false,
                "sources": [
                    {
                        "file": "includes/class-awl-product-data.php",
                        "line": 396
                    }
                ]
            },
            {
                "key": "_awl_save_percent_value",
                "confidence": "verified",
                "cleaned": false,
                "sources": [
                    {
                        "file": "includes/class-awl-product-data.php",
                        "line": 343
                    }
                ]
            }
        ],
        "user_meta": [],
        "term_meta": [],
        "comment_meta": [],
        "roles": [],
        "capabilities": [],
        "post_types": [
            {
                "key": "awl-labels",
                "confidence": "verified",
                "cleaned": false,
                "sources": [
                    {
                        "file": "includes/class-awl-taxonomy.php",
                        "line": 70
                    }
                ]
            }
        ],
        "taxonomies": [],
        "directories": [],
        "rewrite_rules": [],
        "actions": []
    },
    "modifies_core": [],
    "unresolved": []
}