{
    "schema_version": "2.0",
    "plugin": {
        "slug": "advanced-iframe",
        "name": "Advanced iFrame",
        "version": "2026.2",
        "source": "local",
        "scanned_at": "2026-08-16T17:54:55Z",
        "analyzer_version": "0.9.0"
    },
    "grade": "D",
    "score": 44,
    "coverage": {
        "files_scanned": 33,
        "files_skipped": 0,
        "write_calls_found": 31,
        "verified": 12,
        "resolved": 9,
        "pattern": 3,
        "dynamic": 7,
        "resolution_rate": 0.677
    },
    "cleanup": {
        "has_uninstall_php": false,
        "has_uninstall_hook": true,
        "conditional": true,
        "condition_option": "advancediFrameAdminOptions",
        "condition_default": false
    },
    "creates": {
        "options": [
            {
                "key": "advancediFrameAdminOptions",
                "autoload": "unknown",
                "confidence": "resolved",
                "cleaned": true,
                "sources": [
                    {
                        "file": "advanced-iframe.php",
                        "line": 130
                    },
                    {
                        "file": "advanced-iframe.php",
                        "line": 437
                    },
                    {
                        "file": "advanced-iframe.php",
                        "line": 444
                    },
                    {
                        "file": "advanced-iframe.php",
                        "line": 552
                    },
                    {
                        "file": "advanced-iframe.php",
                        "line": 1284
                    },
                    {
                        "file": "advanced-iframe.php",
                        "line": 1293
                    },
                    {
                        "file": "advanced-iframe.php",
                        "line": 1463
                    },
                    {
                        "file": "advanced-iframe.php",
                        "line": 1557
                    },
                    {
                        "file": "advanced-iframe.php",
                        "line": 1590
                    }
                ]
            },
            {
                "key": "advancediFrameParameterData",
                "autoload": "unknown",
                "confidence": "verified",
                "cleaned": true,
                "sources": [
                    {
                        "file": "advanced-iframe.php",
                        "line": 1445
                    },
                    {
                        "file": "includes/advanced-iframe-admin-functions.php",
                        "line": 1353
                    }
                ]
            }
        ],
        "tables": [],
        "cron": [
            {
                "key": "ai_check_iframes_event",
                "recurrence": "daily",
                "confidence": "verified",
                "cleaned": false,
                "sources": [
                    {
                        "file": "advanced-iframe.php",
                        "line": 125
                    }
                ]
            }
        ],
        "transients": [
            {
                "key": "ai_no_rights_post_errors",
                "confidence": "verified",
                "cleaned": false,
                "sources": [
                    {
                        "file": "advanced-iframe.php",
                        "line": 1102
                    }
                ]
            },
            {
                "key": "ai_save_post_errors",
                "confidence": "verified",
                "cleaned": false,
                "sources": [
                    {
                        "file": "advanced-iframe.php",
                        "line": 1585
                    }
                ]
            },
            {
                "key": "ai_save_post_execution",
                "confidence": "verified",
                "cleaned": false,
                "sources": [
                    {
                        "file": "advanced-iframe.php",
                        "line": 1559
                    }
                ]
            },
            {
                "key": "ai_save_post_unfiltered_html",
                "confidence": "verified",
                "cleaned": false,
                "sources": [
                    {
                        "file": "advanced-iframe.php",
                        "line": 1547
                    }
                ]
            },
            {
                "key": "aip_*",
                "confidence": "pattern",
                "cleaned": false,
                "sources": [
                    {
                        "file": "includes/advanced-iframe-main-iframe.php",
                        "line": 348
                    }
                ]
            },
            {
                "key": "aip_discount",
                "confidence": "verified",
                "cleaned": false,
                "sources": [
                    {
                        "file": "advanced-iframe.php",
                        "line": 1277
                    }
                ]
            },
            {
                "key": "aip_discount_message",
                "confidence": "verified",
                "cleaned": false,
                "sources": [
                    {
                        "file": "advanced-iframe.php",
                        "line": 1278
                    }
                ]
            },
            {
                "key": "aip_version",
                "confidence": "verified",
                "cleaned": false,
                "sources": [
                    {
                        "file": "advanced-iframe.php",
                        "line": 1301
                    }
                ]
            }
        ],
        "post_meta": [],
        "user_meta": [
            {
                "key": "closedpostboxes_toplevel_page_advanced-iframe",
                "confidence": "verified",
                "cleaned": false,
                "sources": [
                    {
                        "file": "advanced-iframe.php",
                        "line": 164
                    }
                ]
            }
        ],
        "term_meta": [],
        "comment_meta": [],
        "roles": [],
        "capabilities": [],
        "post_types": [
            {
                "key": "ai_content_page",
                "confidence": "verified",
                "cleaned": false,
                "sources": [
                    {
                        "file": "advanced-iframe.php",
                        "line": 534
                    }
                ]
            }
        ],
        "taxonomies": [],
        "directories": [],
        "rewrite_rules": [
            {
                "key": "^(*",
                "confidence": "pattern",
                "cleaned": false,
                "sources": [
                    {
                        "file": "advanced-iframe.php",
                        "line": 568
                    }
                ]
            },
            {
                "key": "^(.*)/*",
                "confidence": "pattern",
                "cleaned": false,
                "sources": [
                    {
                        "file": "advanced-iframe.php",
                        "line": 562
                    }
                ]
            }
        ],
        "actions": []
    },
    "modifies_core": [],
    "unresolved": [
        {
            "function": "update_option",
            "expression": "$this->adminOptionsName",
            "file": "advanced-iframe-admin-page.php",
            "line": 37
        },
        {
            "function": "update_option",
            "expression": "$this->adminOptionsName",
            "file": "advanced-iframe-admin-page.php",
            "line": 287
        },
        {
            "function": "update_option",
            "expression": "$this->adminOptionsName",
            "file": "advanced-iframe-admin-page.php",
            "line": 571
        },
        {
            "function": "mkdir",
            "expression": "$filenamedir",
            "file": "advanced-iframe.php",
            "line": 1064
        },
        {
            "function": "set_transient",
            "expression": "$cache_key",
            "file": "includes/advanced-iframe-admin-functions.php",
            "line": 742
        },
        {
            "function": "mkdir",
            "expression": "$filenamedir",
            "file": "includes/advanced-iframe-admin-functions.php",
            "line": 1370
        },
        {
            "function": "update_option",
            "expression": "$adminOptionsName",
            "file": "includes/advanced-iframe-main-helper.php",
            "line": 396
        }
    ]
}