{
    "schema_version": "2.0",
    "plugin": {
        "slug": "emailkit",
        "name": "EmailKit",
        "version": "1.6.8",
        "source": "local",
        "scanned_at": "2026-08-16T17:57:04Z",
        "analyzer_version": "0.9.0"
    },
    "grade": "F",
    "score": 0,
    "coverage": {
        "files_scanned": 77,
        "files_skipped": 0,
        "write_calls_found": 26,
        "verified": 21,
        "resolved": 3,
        "pattern": 0,
        "dynamic": 2,
        "resolution_rate": 0.923
    },
    "cleanup": {
        "has_uninstall_php": false,
        "has_uninstall_hook": false,
        "conditional": false,
        "condition_option": null,
        "condition_default": null
    },
    "creates": {
        "options": [
            {
                "key": "emailkit_installed",
                "autoload": "unknown",
                "confidence": "verified",
                "cleaned": false,
                "sources": [
                    {
                        "file": "EmailKit.php",
                        "line": 115
                    }
                ]
            },
            {
                "key": "emailkit_onboard_options",
                "autoload": "unknown",
                "confidence": "resolved",
                "cleaned": false,
                "sources": [
                    {
                        "file": "Promotional/Onboard/Classes/Utils.php",
                        "line": 28
                    }
                ]
            },
            {
                "key": "emailkit_onboard_status",
                "autoload": "yes",
                "confidence": "resolved",
                "cleaned": false,
                "sources": [
                    {
                        "file": "Promotional/Onboard/Onboard.php",
                        "line": 120
                    }
                ]
            },
            {
                "key": "emailkit_options",
                "autoload": "unknown",
                "confidence": "resolved",
                "cleaned": false,
                "sources": [
                    {
                        "file": "Promotional/Util.php",
                        "line": 24
                    }
                ]
            },
            {
                "key": "emailkit_version",
                "autoload": "unknown",
                "confidence": "verified",
                "cleaned": false,
                "sources": [
                    {
                        "file": "EmailKit.php",
                        "line": 123
                    }
                ]
            }
        ],
        "tables": [],
        "cron": [],
        "transients": [],
        "post_meta": [
            {
                "key": "emailkit_template_content_html",
                "confidence": "verified",
                "cleaned": false,
                "sources": [
                    {
                        "file": "includes/Admin/MetaBox.php",
                        "line": 307
                    }
                ]
            },
            {
                "key": "emailkit_template_content_object",
                "confidence": "verified",
                "cleaned": false,
                "sources": [
                    {
                        "file": "includes/Admin/MetaBox.php",
                        "line": 312
                    }
                ]
            },
            {
                "key": "emailkit_template_status",
                "confidence": "verified",
                "cleaned": false,
                "sources": [
                    {
                        "file": "includes/Admin/Api/TemplateData.php",
                        "line": 144
                    },
                    {
                        "file": "includes/Admin/Api/TemplateStatus.php",
                        "line": 104
                    },
                    {
                        "file": "includes/Admin/Api/UpdateData.php",
                        "line": 126
                    },
                    {
                        "file": "includes/Admin/MetaBox.php",
                        "line": 319
                    },
                    {
                        "file": "includes/Admin/MetaBox.php",
                        "line": 321
                    },
                    {
                        "file": "includes/Admin/MetaBox.php",
                        "line": 361
                    }
                ]
            },
            {
                "key": "emailkit_template_title",
                "confidence": "verified",
                "cleaned": false,
                "sources": [
                    {
                        "file": "includes/Admin/MetaBox.php",
                        "line": 295
                    }
                ]
            },
            {
                "key": "emailkit_template_type",
                "confidence": "verified",
                "cleaned": false,
                "sources": [
                    {
                        "file": "includes/Admin/MetaBox.php",
                        "line": 301
                    }
                ]
            }
        ],
        "user_meta": [],
        "term_meta": [],
        "comment_meta": [],
        "roles": [],
        "capabilities": [
            {
                "key": "delete_emailkit",
                "confidence": "verified",
                "cleaned": false,
                "sources": [
                    {
                        "file": "includes/Admin/CPT.php",
                        "line": 30
                    }
                ]
            },
            {
                "key": "delete_published_",
                "confidence": "verified",
                "cleaned": false,
                "sources": [
                    {
                        "file": "includes/Admin/CPT.php",
                        "line": 32
                    }
                ]
            },
            {
                "key": "edit_emailkit",
                "confidence": "verified",
                "cleaned": false,
                "sources": [
                    {
                        "file": "includes/Admin/CPT.php",
                        "line": 25
                    }
                ]
            },
            {
                "key": "edit_others_emailkit",
                "confidence": "verified",
                "cleaned": false,
                "sources": [
                    {
                        "file": "includes/Admin/CPT.php",
                        "line": 26
                    }
                ]
            },
            {
                "key": "edit_published_emailkit",
                "confidence": "verified",
                "cleaned": false,
                "sources": [
                    {
                        "file": "includes/Admin/CPT.php",
                        "line": 31
                    }
                ]
            },
            {
                "key": "publish_emailkit",
                "confidence": "verified",
                "cleaned": false,
                "sources": [
                    {
                        "file": "includes/Admin/CPT.php",
                        "line": 27
                    }
                ]
            },
            {
                "key": "read_emailkit",
                "confidence": "verified",
                "cleaned": false,
                "sources": [
                    {
                        "file": "includes/Admin/CPT.php",
                        "line": 28
                    }
                ]
            },
            {
                "key": "read_private_emailkit",
                "confidence": "verified",
                "cleaned": false,
                "sources": [
                    {
                        "file": "includes/Admin/CPT.php",
                        "line": 29
                    }
                ]
            }
        ],
        "post_types": [
            {
                "key": "emailkit",
                "confidence": "verified",
                "cleaned": false,
                "sources": [
                    {
                        "file": "includes/Admin/CPT.php",
                        "line": 107
                    }
                ]
            }
        ],
        "taxonomies": [],
        "directories": [],
        "rewrite_rules": [],
        "actions": []
    },
    "modifies_core": [],
    "unresolved": [
        {
            "function": "update_user_meta",
            "expression": "$id",
            "file": "includes/Admin/Emails/Helpers/Notice/Notice.php",
            "line": 48
        },
        {
            "function": "set_transient",
            "expression": "$id",
            "file": "includes/Admin/Emails/Helpers/Notice/Notice.php",
            "line": 50
        }
    ]
}