{
    "schema_version": "2.0",
    "plugin": {
        "slug": "simple-back-to-top",
        "name": "Simple Back To Top",
        "version": "1.0",
        "source": "local",
        "scanned_at": "2026-08-16T18:02:08Z",
        "analyzer_version": "0.9.0"
    },
    "grade": "F",
    "score": 49,
    "coverage": {
        "files_scanned": 2,
        "files_skipped": 0,
        "write_calls_found": 2,
        "verified": 2,
        "resolved": 0,
        "pattern": 0,
        "dynamic": 0,
        "resolution_rate": 1.0
    },
    "cleanup": {
        "has_uninstall_php": false,
        "has_uninstall_hook": false,
        "conditional": false,
        "condition_option": null,
        "condition_default": null
    },
    "creates": {
        "options": [
            {
                "key": "sbtt_options",
                "autoload": "unknown",
                "confidence": "verified",
                "cleaned": false,
                "sources": [
                    {
                        "file": "backtotop.php",
                        "line": 24
                    },
                    {
                        "file": "options.php",
                        "line": 30
                    }
                ]
            }
        ],
        "tables": [],
        "cron": [],
        "transients": [],
        "post_meta": [],
        "user_meta": [],
        "term_meta": [],
        "comment_meta": [],
        "roles": [],
        "capabilities": [],
        "post_types": [],
        "taxonomies": [],
        "directories": [],
        "rewrite_rules": [],
        "actions": []
    },
    "modifies_core": [],
    "unresolved": []
}