{
    "schema_version": "2.0",
    "plugin": {
        "slug": "pdf-viewer-block",
        "name": "Gutenberg PDF Viewer Block",
        "version": "1.1",
        "source": "local",
        "scanned_at": "2026-08-16T17:56:39Z",
        "analyzer_version": "0.9.0"
    },
    "grade": "A",
    "score": 100,
    "coverage": {
        "files_scanned": 11,
        "files_skipped": 0,
        "write_calls_found": 0,
        "verified": 0,
        "resolved": 0,
        "pattern": 0,
        "dynamic": 0,
        "resolution_rate": 1.0
    },
    "cleanup": {
        "has_uninstall_php": false,
        "has_uninstall_hook": false,
        "conditional": false,
        "condition_option": null,
        "condition_default": null
    },
    "creates": {
        "options": [],
        "tables": [],
        "cron": [],
        "transients": [],
        "post_meta": [],
        "user_meta": [],
        "term_meta": [],
        "comment_meta": [],
        "roles": [],
        "capabilities": [],
        "post_types": [],
        "taxonomies": [],
        "directories": [],
        "rewrite_rules": [],
        "actions": []
    },
    "modifies_core": [],
    "unresolved": []
}