{
    "schema_version": "2.0",
    "plugin": {
        "slug": "hbagency",
        "name": "HBAgency",
        "version": "1.0.5",
        "source": "local",
        "scanned_at": "2026-08-16T17:56:34Z",
        "analyzer_version": "0.9.0"
    },
    "grade": "F",
    "score": 0,
    "coverage": {
        "files_scanned": 13,
        "files_skipped": 0,
        "write_calls_found": 20,
        "verified": 16,
        "resolved": 0,
        "pattern": 4,
        "dynamic": 0,
        "resolution_rate": 0.8
    },
    "cleanup": {
        "has_uninstall_php": false,
        "has_uninstall_hook": false,
        "conditional": false,
        "condition_option": null,
        "condition_default": null
    },
    "creates": {
        "options": [
            {
                "key": "hbagency_wp_cls",
                "autoload": "unknown",
                "confidence": "verified",
                "cleaned": false,
                "sources": [
                    {
                        "file": "hbagency-ajax-api.php",
                        "line": 204
                    }
                ]
            },
            {
                "key": "hbagency_wp_cmp",
                "autoload": "unknown",
                "confidence": "verified",
                "cleaned": false,
                "sources": [
                    {
                        "file": "hbagency-ajax-api.php",
                        "line": 201
                    },
                    {
                        "file": "hbagency-service.php",
                        "line": 25
                    }
                ]
            },
            {
                "key": "hbagency_wp_enable_ads_txt",
                "autoload": "unknown",
                "confidence": "verified",
                "cleaned": false,
                "sources": [
                    {
                        "file": "hbagency-ajax-api.php",
                        "line": 195
                    }
                ]
            },
            {
                "key": "hbagency_wp_has_cmp",
                "autoload": "unknown",
                "confidence": "verified",
                "cleaned": false,
                "sources": [
                    {
                        "file": "hbagency-service.php",
                        "line": 23
                    }
                ]
            },
            {
                "key": "hbagency_wp_placement_*",
                "autoload": "unknown",
                "confidence": "pattern",
                "cleaned": false,
                "sources": [
                    {
                        "file": "hbagency-ajax-api.php",
                        "line": 114
                    },
                    {
                        "file": "hbagency-ajax-api.php",
                        "line": 146
                    },
                    {
                        "file": "hbagency-ajax-api.php",
                        "line": 165
                    }
                ]
            },
            {
                "key": "hbagency_wp_website_ads_txt",
                "autoload": "unknown",
                "confidence": "verified",
                "cleaned": false,
                "sources": [
                    {
                        "file": "hbagency-service.php",
                        "line": 28
                    }
                ]
            },
            {
                "key": "hbagency_wp_website_ads_txt_additional_lines",
                "autoload": "unknown",
                "confidence": "verified",
                "cleaned": false,
                "sources": [
                    {
                        "file": "hbagency-service.php",
                        "line": 70
                    }
                ]
            },
            {
                "key": "hbagency_wp_website_ext_id",
                "autoload": "unknown",
                "confidence": "verified",
                "cleaned": false,
                "sources": [
                    {
                        "file": "hbagency-service.php",
                        "line": 34
                    }
                ]
            },
            {
                "key": "hbagency_wp_website_id",
                "autoload": "unknown",
                "confidence": "verified",
                "cleaned": false,
                "sources": [
                    {
                        "file": "hbagency-service.php",
                        "line": 10
                    }
                ]
            },
            {
                "key": "hbagency_wp_website_placement_*",
                "autoload": "unknown",
                "confidence": "pattern",
                "cleaned": false,
                "sources": [
                    {
                        "file": "hbagency-service.php",
                        "line": 76
                    }
                ]
            },
            {
                "key": "hbagency_wp_website_placements",
                "autoload": "unknown",
                "confidence": "verified",
                "cleaned": false,
                "sources": [
                    {
                        "file": "hbagency-service.php",
                        "line": 74
                    }
                ]
            },
            {
                "key": "hbagency_wp_website_placements_cache_inarticle",
                "autoload": "unknown",
                "confidence": "verified",
                "cleaned": false,
                "sources": [
                    {
                        "file": "hbagency-config.php",
                        "line": 176
                    }
                ]
            },
            {
                "key": "hbagency_wp_website_script",
                "autoload": "unknown",
                "confidence": "verified",
                "cleaned": false,
                "sources": [
                    {
                        "file": "hbagency-service.php",
                        "line": 33
                    }
                ]
            },
            {
                "key": "hbagency_wp_website_status",
                "autoload": "unknown",
                "confidence": "verified",
                "cleaned": false,
                "sources": [
                    {
                        "file": "hbagency-service.php",
                        "line": 20
                    }
                ]
            },
            {
                "key": "hbagency_wp_website_status_detail",
                "autoload": "unknown",
                "confidence": "verified",
                "cleaned": false,
                "sources": [
                    {
                        "file": "hbagency-service.php",
                        "line": 21
                    }
                ]
            },
            {
                "key": "hbagency_wp_website_url",
                "autoload": "unknown",
                "confidence": "verified",
                "cleaned": false,
                "sources": [
                    {
                        "file": "hbagency-service.php",
                        "line": 22
                    }
                ]
            }
        ],
        "tables": [],
        "cron": [
            {
                "key": "hbagency_wp_cron_check_for_updates",
                "recurrence": "twicedaily",
                "confidence": "verified",
                "cleaned": false,
                "sources": [
                    {
                        "file": "hbagency-service.php",
                        "line": 13
                    }
                ]
            }
        ],
        "transients": [],
        "post_meta": [],
        "user_meta": [],
        "term_meta": [],
        "comment_meta": [],
        "roles": [],
        "capabilities": [],
        "post_types": [],
        "taxonomies": [],
        "directories": [],
        "rewrite_rules": [],
        "actions": []
    },
    "modifies_core": [],
    "unresolved": []
}