{
    "schema_version": "2.0",
    "plugin": {
        "slug": "bellows-accordion-menu",
        "name": "Bellows Accordion Menu",
        "version": "1.4.4",
        "source": "local",
        "scanned_at": "2026-08-16T17:54:38Z",
        "analyzer_version": "0.9.0"
    },
    "grade": "F",
    "score": 49,
    "coverage": {
        "files_scanned": 20,
        "files_skipped": 0,
        "write_calls_found": 6,
        "verified": 1,
        "resolved": 4,
        "pattern": 0,
        "dynamic": 1,
        "resolution_rate": 0.833
    },
    "cleanup": {
        "has_uninstall_php": false,
        "has_uninstall_hook": false,
        "conditional": false,
        "condition_option": null,
        "condition_default": null
    },
    "creates": {
        "options": [
            {
                "key": "_bellows_menu_item_styles",
                "autoload": "unknown",
                "confidence": "resolved",
                "cleaned": false,
                "sources": [
                    {
                        "file": "Bellows.class.php",
                        "line": 296
                    }
                ]
            },
            {
                "key": "_bellows_menu_styles",
                "autoload": "unknown",
                "confidence": "resolved",
                "cleaned": false,
                "sources": [
                    {
                        "file": "customizer/customizer.styles.manager.php",
                        "line": 244
                    },
                    {
                        "file": "customizer/customizer.styles.manager.php",
                        "line": 252
                    }
                ]
            },
            {
                "key": "bellows_pro_version",
                "autoload": "unknown",
                "confidence": "verified",
                "cleaned": false,
                "sources": [
                    {
                        "file": "Bellows.class.php",
                        "line": 108
                    }
                ]
            }
        ],
        "tables": [],
        "cron": [],
        "transients": [
            {
                "key": "_bellows_generated_styles",
                "confidence": "resolved",
                "cleaned": false,
                "sources": [
                    {
                        "file": "customizer/customizer.styles.manager.php",
                        "line": 11
                    }
                ]
            }
        ],
        "post_meta": [],
        "user_meta": [],
        "term_meta": [],
        "comment_meta": [],
        "roles": [],
        "capabilities": [],
        "post_types": [],
        "taxonomies": [],
        "directories": [],
        "rewrite_rules": [],
        "actions": []
    },
    "modifies_core": [],
    "unresolved": [
        {
            "function": "add_option",
            "expression": "$section['id']",
            "file": "admin/settings-api.class.php",
            "line": 112
        }
    ]
}