{
    "schema_version": "2.0",
    "plugin": {
        "slug": "zibal-payment-gateway-for-woocommerce",
        "name": "Gateway zibal for Woocommerce",
        "version": "1.9",
        "source": "local",
        "scanned_at": "2026-08-16T18:04:36Z",
        "analyzer_version": "0.9.0"
    },
    "grade": "F",
    "score": 49,
    "coverage": {
        "files_scanned": 3,
        "files_skipped": 0,
        "write_calls_found": 3,
        "verified": 3,
        "resolved": 0,
        "pattern": 0,
        "dynamic": 0,
        "resolution_rate": 1.0
    },
    "cleanup": {
        "has_uninstall_php": false,
        "has_uninstall_hook": false,
        "conditional": false,
        "condition_option": null,
        "condition_default": null
    },
    "creates": {
        "options": [],
        "tables": [],
        "cron": [],
        "transients": [],
        "post_meta": [
            {
                "key": "_card_number",
                "confidence": "verified",
                "cleaned": false,
                "sources": [
                    {
                        "file": "class-wc-gateway-zibal.php",
                        "line": 373
                    }
                ]
            },
            {
                "key": "_tracking_number",
                "confidence": "verified",
                "cleaned": false,
                "sources": [
                    {
                        "file": "class-wc-gateway-zibal.php",
                        "line": 374
                    }
                ]
            },
            {
                "key": "_transaction_id",
                "confidence": "verified",
                "cleaned": false,
                "sources": [
                    {
                        "file": "class-wc-gateway-zibal.php",
                        "line": 372
                    }
                ]
            }
        ],
        "user_meta": [],
        "term_meta": [],
        "comment_meta": [],
        "roles": [],
        "capabilities": [],
        "post_types": [],
        "taxonomies": [],
        "directories": [],
        "rewrite_rules": [],
        "actions": []
    },
    "modifies_core": [],
    "unresolved": []
}