{
    "schema_version": "2.0",
    "plugin": {
        "slug": "sqlite-database-integration",
        "name": "SQLite Database Integration",
        "version": "3.0.0",
        "source": "local",
        "scanned_at": "2026-08-16T18:01:08Z",
        "analyzer_version": "0.9.0"
    },
    "grade": "F",
    "score": 49,
    "coverage": {
        "files_scanned": 41,
        "files_skipped": 0,
        "write_calls_found": 9,
        "verified": 8,
        "resolved": 0,
        "pattern": 0,
        "dynamic": 1,
        "resolution_rate": 0.889
    },
    "cleanup": {
        "has_uninstall_php": false,
        "has_uninstall_hook": false,
        "conditional": false,
        "condition_option": null,
        "condition_default": null
    },
    "creates": {
        "options": [],
        "tables": [],
        "cron": [],
        "transients": [],
        "post_meta": [],
        "user_meta": [
            {
                "key": "default_password_nag",
                "confidence": "verified",
                "cleaned": false,
                "sources": [
                    {
                        "file": "wp-includes/sqlite/install-functions.php",
                        "line": 137
                    }
                ]
            }
        ],
        "term_meta": [],
        "comment_meta": [],
        "roles": [],
        "capabilities": [],
        "post_types": [],
        "taxonomies": [],
        "directories": [],
        "rewrite_rules": [],
        "actions": []
    },
    "modifies_core": [
        {
            "type": "option",
            "key": "WPLANG",
            "confidence": "verified",
            "sources": [
                {
                    "file": "wp-includes/sqlite/install-functions.php",
                    "line": 112
                }
            ]
        },
        {
            "type": "option",
            "key": "admin_email",
            "confidence": "verified",
            "sources": [
                {
                    "file": "wp-includes/sqlite/install-functions.php",
                    "line": 105
                }
            ]
        },
        {
            "type": "option",
            "key": "blog_public",
            "confidence": "verified",
            "sources": [
                {
                    "file": "wp-includes/sqlite/install-functions.php",
                    "line": 106
                }
            ]
        },
        {
            "type": "option",
            "key": "blogname",
            "confidence": "verified",
            "sources": [
                {
                    "file": "wp-includes/sqlite/install-functions.php",
                    "line": 104
                }
            ]
        },
        {
            "type": "option",
            "key": "default_pingback_flag",
            "confidence": "verified",
            "sources": [
                {
                    "file": "wp-includes/sqlite/install-functions.php",
                    "line": 121
                }
            ]
        },
        {
            "type": "option",
            "key": "fresh_site",
            "confidence": "verified",
            "sources": [
                {
                    "file": "wp-includes/sqlite/install-functions.php",
                    "line": 109
                }
            ]
        },
        {
            "type": "option",
            "key": "siteurl",
            "confidence": "verified",
            "sources": [
                {
                    "file": "wp-includes/sqlite/install-functions.php",
                    "line": 117
                }
            ]
        }
    ],
    "unresolved": [
        {
            "function": "mkdir",
            "expression": "$dir",
            "file": "wp-includes/sqlite/class-wp-sqlite-db.php",
            "line": 793
        }
    ]
}