{
    "schema_version": "2.0",
    "plugin": {
        "slug": "jquery-validation-for-contact-form-7",
        "name": "Jquery Validation For Contact Form 7 (Lite)",
        "version": "5.4.3",
        "source": "local",
        "scanned_at": "2026-08-16T17:59:00Z",
        "analyzer_version": "0.9.0"
    },
    "grade": "F",
    "score": 48,
    "coverage": {
        "files_scanned": 9,
        "files_skipped": 0,
        "write_calls_found": 5,
        "verified": 4,
        "resolved": 0,
        "pattern": 0,
        "dynamic": 1,
        "resolution_rate": 0.8
    },
    "cleanup": {
        "has_uninstall_php": false,
        "has_uninstall_hook": false,
        "conditional": false,
        "condition_option": null,
        "condition_default": null
    },
    "creates": {
        "options": [
            {
                "key": "jvcf7_current_version",
                "autoload": "yes",
                "confidence": "verified",
                "cleaned": false,
                "sources": [
                    {
                        "file": "includes/functions/jvcf7_admin_functions.php",
                        "line": 28
                    }
                ]
            },
            {
                "key": "jvcf7_install_date",
                "autoload": "yes",
                "confidence": "verified",
                "cleaned": false,
                "sources": [
                    {
                        "file": "includes/functions/jvcf7_admin_functions.php",
                        "line": 27
                    }
                ]
            },
            {
                "key": "jvcf7_invalid_field_design",
                "autoload": "unknown",
                "confidence": "verified",
                "cleaned": false,
                "sources": [
                    {
                        "file": "includes/functions/jvcf7_admin_functions.php",
                        "line": 47
                    }
                ]
            },
            {
                "key": "jvcf7_show_label_error",
                "autoload": "unknown",
                "confidence": "verified",
                "cleaned": false,
                "sources": [
                    {
                        "file": "includes/functions/jvcf7_admin_functions.php",
                        "line": 46
                    }
                ]
            }
        ],
        "tables": [],
        "cron": [],
        "transients": [],
        "post_meta": [],
        "user_meta": [],
        "term_meta": [],
        "comment_meta": [],
        "roles": [],
        "capabilities": [],
        "post_types": [],
        "taxonomies": [],
        "directories": [],
        "rewrite_rules": [],
        "actions": []
    },
    "modifies_core": [],
    "unresolved": [
        {
            "function": "add_option",
            "expression": "$option_name",
            "file": "includes/functions/jvcf7_admin_functions.php",
            "line": 33
        }
    ]
}