{
    "schema_version": "2.0",
    "plugin": {
        "slug": "woocommerce-auto-added-coupons",
        "name": "Extended Coupon Features for WooCommerce FREE",
        "version": "3.4.2",
        "source": "local",
        "scanned_at": "2026-08-16T17:59:23Z",
        "analyzer_version": "0.9.0"
    },
    "grade": "F",
    "score": 49,
    "coverage": {
        "files_scanned": 18,
        "files_skipped": 0,
        "write_calls_found": 5,
        "verified": 2,
        "resolved": 1,
        "pattern": 0,
        "dynamic": 2,
        "resolution_rate": 0.6
    },
    "cleanup": {
        "has_uninstall_php": false,
        "has_uninstall_hook": false,
        "conditional": false,
        "condition_option": null,
        "condition_default": null
    },
    "creates": {
        "options": [],
        "tables": [],
        "cron": [],
        "transients": [
            {
                "key": "wjecf_situation_transient_version",
                "confidence": "resolved",
                "cleaned": false,
                "sources": [
                    {
                        "file": "includes/plugins/WJECF_Autocoupon.php",
                        "line": 823
                    }
                ]
            }
        ],
        "post_meta": [
            {
                "key": "_wjecf_excluded_shipping_restrictions",
                "confidence": "verified",
                "cleaned": false,
                "sources": [
                    {
                        "file": "includes/plugins/WJECF_Admin_Data_Update.php",
                        "line": 111
                    }
                ]
            },
            {
                "key": "_wjecf_shipping_restrictions",
                "confidence": "verified",
                "cleaned": false,
                "sources": [
                    {
                        "file": "includes/plugins/WJECF_Admin_Data_Update.php",
                        "line": 94
                    }
                ]
            }
        ],
        "user_meta": [],
        "term_meta": [],
        "comment_meta": [],
        "roles": [],
        "capabilities": [],
        "post_types": [],
        "taxonomies": [],
        "directories": [],
        "rewrite_rules": [],
        "actions": []
    },
    "modifies_core": [],
    "unresolved": [
        {
            "function": "update_option",
            "expression": "$this->option_name",
            "file": "includes/class-wjecf-options.php",
            "line": 88
        },
        {
            "function": "update_post_meta",
            "expression": "$meta_key",
            "file": "includes/class-wjecf-wrap.php",
            "line": 375
        }
    ]
}